"Status","Start Time","Stop Time","Duration in ms","Parent Suite","Suite","Sub Suite","Test Class","Test Method","Name","Description"
"passed","Thu Apr 06 00:44:27 GMT 2023","Thu Apr 06 00:44:28 GMT 2023","763","","Tests.TestTermsAndConditions","","Tests.TestTermsAndConditions","isDisplayedTermsAndConditionsTest","isDisplayedTermsAndConditionsTest()","Visitor open the website for the first time and Terms&Conditions is displayed on the screen."
"failed","Thu Apr 06 00:44:26 GMT 2023","Thu Apr 06 00:44:27 GMT 2023","1257","","Tests.TestTermsAndConditions","","Tests.TestTermsAndConditions","registrationWithRejectedTermsAndConditionsTest","registrationWithRejectedTermsAndConditionsTest()","Visitor open the website for the first time, reject the Terms&Conditions, so visitor cannot register on the website."
"passed","Thu Apr 06 00:44:19 GMT 2023","Thu Apr 06 00:44:22 GMT 2023","3615","","Tests.TestRegistration","","Tests.TestRegistration","registerTest","registerTest()","A new user accept Terms&Conditions and register on the site."
"passed","Thu Apr 06 00:44:23 GMT 2023","Thu Apr 06 00:44:23 GMT 2023","614","","Tests.TestDataModification","","Tests.TestDataModification","ModificationProfileTest","ModificationProfileTest()","......................."
"passed","Thu Apr 06 00:44:23 GMT 2023","Thu Apr 06 00:44:24 GMT 2023","1262","","Tests.TestLoginLogout","","Tests.TestLoginLogout","loginTest","loginTest()","User accept Terms&Conditions and log in with registered username and password."
"passed","Thu Apr 06 00:44:24 GMT 2023","Thu Apr 06 00:44:26 GMT 2023","1402","","Tests.TestLoginLogout","","Tests.TestLoginLogout","logoutTest","logoutTest()","User accept Terms&Conditions, log in with registered username/password and log out from the site."
